{
  "schema_version": 1,
  "convocatoria": "li-test",
  "source": {
    "title": "Nombramientos (sintético)",
    "url": "https://example.org/boe",
    "boe_id": null
  },
  "anonymized": true,
  "total": 250,
  "notes": null,
  "assignments": [
    {
      "order": 1,
      "organism": "Ministerio de prueba",
      "unit": null,
      "province": "Madrid",
      "locality": "Madrid"
    },
    {
      "order": 2,
      "organism": "Ministerio de prueba",
      "unit": null,
      "province": "Sevilla",
      "locality": "Sevilla"
    },
    {
      "order": 3,
      "organism": "Ministerio de prueba",
      "unit": null,
      "province": "Madrid",
      "locality": "Madrid"
    },
    {
      "order": 4,
      "organism": "Ministerio de prueba",
      "unit": null,
      "province": "Sevilla",
      "locality": "Sevilla"
    },
    {
      "order": 5,
      "organism": "Ministerio de prueba",
      "unit": null,
      "province": "Barcelona",
      "locality": "Barcelona"
    },
    {
      "order": 6,
      "organism": "Ministerio de prueba",
      "unit": null,
      "province": "Sevilla",
      "locality": "Sevilla"
    },
    {
      "order": 7,
      "organism": "Ministerio de prueba",
      "unit": null,
      "province": "Toledo",
      "locality": "Toledo"
    },
    {
      "order": 8,
      "organism": "Ministerio de prueba",
      "unit": null,
      "province": "Sevilla",
      "locality": "Sevilla"
    },
    {
      "order": 9,
      "organism": "Ministerio de prueba",
      "unit": null,
      "province": "Madrid",
      "locality": "Madrid"
    },
    {
      "order": 10,
      "organism": "Ministerio de prueba",
      "unit": null,
      "province": "Sevilla",
      "locality": "Sevilla"
    },
    {
      "order": 11,
      "organism": "Ministerio de prueba",
      "unit": null,
      "province": "Madrid",
      "locality": "Madrid"
    },
    {
      "order": 12,
      "organism": "Ministerio de prueba",
      "unit": null,
      "province": "Sevilla",
      "locality": "Sevilla"
    },
    {
      "order": 13,
      "organism": "Ministerio de prueba",
      "unit": null,
      "province": "Madrid",
      "locality": "Madrid"
    },
    {
      "order": 14,
      "organism": "Ministerio de prueba",
      "unit": null,
      "province": "Sevilla",
      "locality": "Sevilla"
    },
    {
      "order": 15,
      "organism": "Ministerio de prueba",
      "unit": null,
      "province": "Barcelona",
      "locality": "Barcelona"
    },
    {
      "order": 16,
      "organism": "Ministerio de prueba",
      "unit": null,
      "province": "Sevilla",
      "locality": "Sevilla"
    },
    {
      "order": 17,
      "organism": "Ministerio de prueba",
      "unit": null,
      "province": "Madrid",
      "locality": "Madrid"
    },
    {
      "order": 18,
      "organism": "Ministerio de prueba",
      "unit": null,
      "province": "Sevilla",
      "locality": "Sevilla"
    },
    {
      "order": 19,
      "organism": "Ministerio de prueba",
      "unit": null,
      "province": "Madrid",
      "locality": "Madrid"
    },
    {
      "order": 20,
      "organism": "Ministerio de prueba",
      "unit": null,
      "province": "Sevilla",
      "locality": "Sevilla"
    },
    {
      "order": 21,
      "organism": "Ministerio de prueba",
      "unit": null,
      "province": "Toledo",
      "locality": "Toledo"
    },
    {
      "order": 22,
      "organism": "Ministerio de prueba",
      "unit": null,
      "province": "Madrid",
      "locality": "Madrid"
    },
    {
      "order": 23,
      "organism": "Ministerio de prueba",
      "unit": null,
      "province": "Madrid",
      "locality": "Madrid"
    },
    {
      "order": 24,
      "organism": "Ministerio de prueba",
      "unit": null,
      "province": "Madrid",
      "locality": "Madrid"
    },
    {
      "order": 25,
      "organism": "Ministerio de prueba",
      "unit": null,
      "province": "Barcelona",
      "locality": "Barcelona"
    },
    {
      "order": 26,
      "organism": "Ministerio de prueba",
      "unit": null,
      "province": "Madrid",
      "locality": "Madrid"
    },
    {
      "order": 27,
      "organism": "Ministerio de prueba",
      "unit": null,
      "province": "Madrid",
      "locality": "Madrid"
    },
    {
      "order": 28,
      "organism": "Ministerio de prueba",
      "unit": null,
      "province": "Toledo",
      "locality": "Toledo"
    },
    {
      "order": 29,
      "organism": "Ministerio de prueba",
      "unit": null,
      "province": "Madrid",
      "locality": "Madrid"
    },
    {
      "order": 30,
      "organism": "Ministerio de prueba",
      "unit": null,
      "province": "Barcelona",
      "locality": "Barcelona"
    },
    {
      "order": 31,
      "organism": "Ministerio de prueba",
      "unit": null,
      "province": "Madrid",
      "locality": "Madrid"
    },
    {
      "order": 32,
      "organism": "Ministerio de prueba",
      "unit": null,
      "province": "Madrid",
      "locality": "Madrid"
    },
    {
      "order": 33,
      "organism": "Ministerio de prueba",
      "unit": null,
      "province": "Bizkaia",
      "locality": "Leioa"
    },
    {
      "order": 34,
      "organism": "Ministerio de prueba",
      "unit": null,
      "province": "Madrid",
      "locality": "Madrid"
    },
    {
      "order": 35,
      "organism": "Ministerio de prueba",
      "unit": null,
      "province": "Barcelona",
      "locality": "Barcelona"
    },
    {
      "order": 36,
      "organism": "Ministerio de prueba",
      "unit": null,
      "province": "Madrid",
      "locality": "Madrid"
    },
    {
      "order": 37,
      "organism": "Ministerio de prueba",
      "unit": null,
      "province": "Madrid",
      "locality": "Madrid"
    },
    {
      "order": 38,
      "organism": "Ministerio de prueba",
      "unit": null,
      "province": "Madrid",
      "locality": "Madrid"
    },
    {
      "order": 39,
      "organism": "Ministerio de prueba",
      "unit": null,
      "province": "Madrid",
      "locality": "Madrid"
    },
    {
      "order": 40,
      "organism": "Ministerio de prueba",
      "unit": null,
      "province": "Barcelona",
      "locality": "Barcelona"
    },
    {
      "order": 41,
      "organism": "Ministerio de prueba",
      "unit": null,
      "province": "Madrid",
      "locality": "Madrid"
    },
    {
      "order": 42,
      "organism": "Ministerio de prueba",
      "unit": null,
      "province": "Toledo",
      "locality": "Toledo"
    },
    {
      "order": 43,
      "organism": "Ministerio de prueba",
      "unit": null,
      "province": "Madrid",
      "locality": "Madrid"
    },
    {
      "order": 44,
      "organism": "Ministerio de prueba",
      "unit": null,
      "province": "Madrid",
      "locality": "Madrid"
    },
    {
      "order": 45,
      "organism": "Ministerio de prueba",
      "unit": null,
      "province": "Barcelona",
      "locality": "Barcelona"
    },
    {
      "order": 46,
      "organism": "Ministerio de prueba",
      "unit": null,
      "province": "Madrid",
      "locality": "Madrid"
    },
    {
      "order": 47,
      "organism": "Ministerio de prueba",
      "unit": null,
      "province": "Madrid",
      "locality": "Madrid"
    },
    {
      "order": 48,
      "organism": "Ministerio de prueba",
      "unit": null,
      "province": "Madrid",
      "locality": "Madrid"
    },
    {
      "order": 49,
      "organism": "Ministerio de prueba",
      "unit": null,
      "province": "Toledo",
      "locality": "Toledo"
    },
    {
      "order": 50,
      "organism": "Ministerio de prueba",
      "unit": null,
      "province": "Barcelona",
      "locality": "Barcelona"
    },
    {
      "order": 51,
      "organism": "Ministerio de prueba",
      "unit": null,
      "province": "Madrid",
      "locality": "Madrid"
    },
    {
      "order": 52,
      "organism": "Ministerio de prueba",
      "unit": null,
      "province": "Madrid",
      "locality": "Madrid"
    },
    {
      "order": 53,
      "organism": "Ministerio de prueba",
      "unit": null,
      "province": "Madrid",
      "locality": "Madrid"
    },
    {
      "order": 54,
      "organism": "Ministerio de prueba",
      "unit": null,
      "province": "Madrid",
      "locality": "Madrid"
    },
    {
      "order": 55,
      "organism": "Ministerio de prueba",
      "unit": null,
      "province": "Barcelona",
      "locality": "Barcelona"
    },
    {
      "order": 56,
      "organism": "Ministerio de prueba",
      "unit": null,
      "province": "Toledo",
      "locality": "Toledo"
    },
    {
      "order": 57,
      "organism": "Ministerio de prueba",
      "unit": null,
      "province": "Madrid",
      "locality": "Madrid"
    },
    {
      "order": 58,
      "organism": "Ministerio de prueba",
      "unit": null,
      "province": "Madrid",
      "locality": "Madrid"
    },
    {
      "order": 59,
      "organism": "Ministerio de prueba",
      "unit": null,
      "province": "Madrid",
      "locality": "Madrid"
    },
    {
      "order": 60,
      "organism": "Ministerio de prueba",
      "unit": null,
      "province": "Barcelona",
      "locality": "Barcelona"
    },
    {
      "order": 61,
      "organism": "Ministerio de prueba",
      "unit": null,
      "province": "Bizkaia",
      "locality": "Leioa"
    },
    {
      "order": 62,
      "organism": "Ministerio de prueba",
      "unit": null,
      "province": "Madrid",
      "locality": "Madrid"
    },
    {
      "order": 63,
      "organism": "Ministerio de prueba",
      "unit": null,
      "province": "Toledo",
      "locality": "Toledo"
    },
    {
      "order": 64,
      "organism": "Ministerio de prueba",
      "unit": null,
      "province": "Madrid",
      "locality": "Madrid"
    },
    {
      "order": 65,
      "organism": "Ministerio de prueba",
      "unit": null,
      "province": "Barcelona",